{
  "schema_version": 1,
  "core_documents": ["oracle-rules/core/operating-model.md"],
  "packs": {
    "fixture": {
      "extensions": [],
      "managed_files": []
    }
  },
  "rules": [
    {
      "key": "fixture.judgment",
      "state": "active",
      "decision": "judgment",
      "pack": "fixture"
    }
  ]
}
